group_id,name,category_id,monthly_fee_USD$
7175132,Meditate in Chicago,22,10
7244202,"ROSICRUCIANS AMORC, SAN FRANCISCO, CA",22,11
7298522,SoulCollageSoire in the Castro,22,17
7383372,Sahaja Yoga meditation,22,3
7539462,Healing Circle NYC,22,23
7563582,New Vision Interspiritual Seminary,22,24
7799012,"Shamanism, Spiritualism, Community Love",22,21
7834302,Dream Catchers of Chicago,22,22
7955582,Silent Party with Spirit & Art,22,12
8007092,Soul Empowerment,22,14
8036092,The Work of Byron Katie Manhattan UWS,22,4
9557612,"ZBINAPORI: The Wilderness Medicine of Sound, Body & Breath",22,15
9671532,Tahuti Lodge O.T.O. Meetup Group,22,17
9798532,Paradise Found: Find Your Inner Paradise!,22,8
9840892,Tarot and Metaphysical Symbolism,22,8
10311132,SF Free Hypnosis Practice Group,22,5
10367332,Esoteric Vision & Healing NYC,22,22
10800082,"Storytellers, Comedians, and Tricksters! [SF Bay Area]",22,0
10831792,Personal Success Warriors,22,16
10907212,Chicago - North Center/Lincoln Square EFT Tapping,22,1
10919342,Hypnosis: Self Empowered Minds,22,11
11241862,Rogers Park Weekly Candle Lit Meditation & Oneness Blessing,22,11
11674032,Chicago Spiritual Friends,22,1
11717122,Psychic Development and Spirit Contact,22,22
11732872,LiveMind Meditation Chicago,22,6
11876832,Raise Your Vibration Of The Bay Area,22,8
11905412,New York Theosophical Society,22,13
11914822,New York Mary Magdalene Meetup,22,14
12031802,Sacred Gatherings and Events,22,2
12635932,"New York Spiritual Growth, Meditation, and Breathwork Meetup",22,11
12663232,NYC Sound and Music Healing,22,3
12701582,The Women's Circle,22,7
13054292,Quest Bookshop,22,2
13232912,NYC Tantra:The Sensual Art of Love,22,21
13308712,New York Tarot Journeyers' Group,22,19
13444752,"Spiritual Events with Skydin in Manhattan, NY",22,7
13757272,Free Seminars & Business Training NYC,22,3
13825282,Journey Through The Akashic Records,22,16
14020532,Saturday Morning Drop and Sit meditation class,22,8
14036792,F.L.O.-N.Y.C. Hermetic Qabalah Study Group,22,3
14459312,San Francisco Shambhala Center,22,6
14616192,Psychonaut SF/Bay Area,22,17
14844662,CelebrateLIFE! Progressive Spiritualist Community,22,16
14914772,Thursdays Vegan/Livefood Happy Hour & Dinner with Live Music,22,11
15169082,NYC Life Bliss Meditators,22,4
15175142,New York Tarot Tarotology Meetup,22,3
15762672,ThetaHealingNYC,22,18
15849652,NYC Hindu/Vedic Meditation & Spirituality,22,12
15851062,Manifest Your Reality NYC!,22,19
16076492,"The Temple of Hecate, Inc.",22,8
16164712,Virtual / Astral NYC,22,21
16248162,The Witch's Academy of Hekate's Sacred Temple,22,19
16301122,LUNATION  New York Full / New Moon Shamanic Meetup,22,8
17015232,Real Sex Education,22,4
17063082,Live Love Tantra,22,23
17142982,Castro Reiki Healing,22,5
17147902,Consciousness Hacking NYC,22,11
17302282,Waking Up (by Sam Harris) Discussion,22,16
17399792,Soul Therapy for Women NYC,22,12
17424562,Columbia University Buddhist Association Alumni,22,17
17470992,"Spiritual Sensuality: Tantra, Meditation, & Yoga",22,21
17609062,The Body Electric School Chicago,22,5
17759102,The Big Lotus,22,0
17973232,Explore Sacred Sexuality,22,13
17975312,"Chicago Healing, Intuition & Spirituality Meetup",22,13
18166982,United Palace House of Inspiration,22,2
18182119,Friday Night Midtown Tarot Meetup,22,8
18194812,SF Consciousness and Soul Path Meetup,22,12
18223910,Credo Center for Spiritual Living Meetup,22,4
18263547,CRS Spirituality & Social Change Meetup,22,13
18293193,"Date Night: Passion, Intimacy & Playfulness in Relationship",22,4
18296077,Windy City Gnosis,22,14
18399762,SF Bay Area - The purpose of Life in Buddhism Study Group,22,21
18401392,Gay Men Erotic Spirituality San Francisco,22,5
18419588,NYC Healing & Mediumship,22,9
18420195,Tantra Play Club,22,21
18442096,I philosophy NYC,22,13
18449512,New York Area Transmission Meditation Meetup,22,24
18484362,San Francisco Metaphysics Meetup,22,16
18485091,Project Illuminated Meetup,22,13
18486243,Namaste Bookshop & Healing Center Meetup Group NYC,22,6
18519912,Zazen and Dharma Talk,22,22
18526628,The Meditation and Ritual Lab,22,6
18538079,Metaphysical Awakenings,22,15
18570974,Aquarian Spiritual Development,22,22
18575690,Transcendental Tantra NYC,22,1
18609161,Healing NY,22,20
18613178,The Reiki Brigade,22,9
18615356,Book Club for The Eight-Circuit Brain by Antero Alli,22,9
18627028,Emperor Norton San Francisco Pagan Society,22,24
18644555,Unity Center of New York City,22,20
18649778,"Circling: get heard, understood and appreciated",22,6
18666697,Living In Your Truth Community,22,12
18674676,Theosophy Hall,22,24
18686717,Manifest Your Power! Goddess Sister Circle NYC,22,24
18692236,Sound Healing Circle NYC,22,10
18701441,NYC Women's Spiritual Empowerment Group,22,22
18709151,NYC Maitreya Sangha,22,8
18722638,Nonduality in NY,22,23
18723284,Raise Your Vibration of New York,22,24
18741697,New York Family Constellations,22,6
18777305,Creative Genius SF: Women Changemakers,22,22
18780380,AYAM Healing with Plants,22,6
18802201,ACIM -The Little Garden Study Group,22,21
18811268,California Men's Gathering Bay Area Events,22,15
18821132,San Francisco Tao Movement and Tao Dance,22,1
18821152,Women's Healing Circle Bay Area Meetup,22,15
18848829,Bay Area Spiritual Events,22,23
18870894,Entheogen Integration Circle,22,1
18913135,Younger Adult Meditation & Metaphysics (YAMMSF),22,5
18927793,SF Seth Meetup,22,12
18958040,San Francisco Spiritual Explorers,22,19
18964249,Younger Adult Meditation & Metaphysics (YAMMNYC),22,23
19001016,Ancestral Journey,22,9
19016453,The Connection Movement,22,17
19017573,Upper West Side Enneagram Meetup,22,10
19017691,Sacred Women's Circle,22,3
19018563,Love Peace Harmony Group,22,0
19024686,Soul Centered Movement Community,22,11
19025252,Proctor Gallagher Mastermind Network- NYC,22,20
19063323,Spiritual Self Journey of New York,22,8
19078625,MENitation NYC,22,7
19084141,Celebrating the Body Erotic for Women in NYC,22,24
19095040,Gurdjieff of New York -- Meetup Events,22,8
19097287,Pamsula Zen Center,22,1
19109256,One Spirit Learning Alliance Community Events,22,13
19140004,Reiki Certification Workshop,22,17
19146390,New York Buddhism and Purpose of Life Meetup,22,8
19169683,Honoring Divine Feminine Attributes,22,7
19173155,Emerald Astrology&Tarot Group,22,4
19184494,Women's Law of Attraction Self-Empowerment Meetup,22,5
19193171,Empowered Hypnosis Wellness Centers- NYC,22,24
19212490,San Francisco Shamanic Drumming and Journey Circle,22,20
19214575,"3rdeyeopennycpsychic: Meet Your Goddess, Guides,Shamans",22,13
19249852,Medical Intuition,22,2
19250934,College of ThelemaAgape Study Group,22,23
19261268,NEW YORK LAW OF ATTRACTION WORKSHOP,22,6
19299477,Meditation at the Moon,22,14
19311020,Psychedelics And The Future Of Psychiatry,22,1
19312005,Life Purpose & Creative Expression Meetup NYC,22,1
19347691,New Thought Movement Reading Club,22,15
19446740,The Work of Byron Katie NYC,22,6
19448887,Social Mindfulness in Action,22,1
19450852,Berkeley Community of Pioneering Souls,22,13
19451027,The Sacred Alchemy Weekly Healing Circle,22,24
19479463,Chicago Yoga Esoteric Meetup,22,16
19494337,Chicago mantra siddhi meetup,22,17
19591066,Private Channeling Group- NYC,22,8
19640671,San Francisco Bay Area Transitionalism Meetup,22,19
19659008,New York Warrior Goddesses,22,12
19731740,Heartfulness Guided Meditation Meetup -  NYC,22,23
19806144,Pagan Environmental Coalition of New York City,22,24
19833895,Doves of Aphrodite,22,18
19845388,Manhattan Healing Toolbox for Transformation,22,19
19855224,Fearless Living Institute,22,8
19860978,Chicago South Side Spiritual Experiences Group,22,7
19909257,"Soul Gym, Exercising Non-Religious Spirituality, Chicago",22,18
19933384,Bay Area Reiki Share,22,11
19935488,Communal Adopting/Fostering Families,22,8
19936669,Young Adult Conversations on Spirituality,22,19
19937525,Your Dream Life Now,22,3
19965843,A Course in Miracles - Events and Groups in Lower Nob Hill,22,6
19968092,Gurdjieff Readings from All and Everything - New York,22,5
19983436,New York Self-Exploration: How to Be Your Own Psychologist,22,3
19986153,Ascended Masters Teaching Through the Messenger T Mickushina,22,14
19997453,NYC Healing Circle,22,16
20003733,Integrative Hypnosis Practice Group,22,1
20010518,Oneness Project Light,22,5
20040833,New Moon SisterCircles Meetup,22,15
20125462,Chicago Occult,22,10
20156543,Richmond District  San Francisco Early Bird Tai Chi,22,12
20157799,Connect with SELF - NYC Conscious Community,22,21
20173214,Shamanic and Reiki Trainings with Jonathan Hammond,22,19
20173508,NYC Metaphysical Den,22,10
20185084,Starseed Nation,22,23
20185414,The C.G. Jung Institute of San Francisco,22,17
20186260,New York Aquarian Spiritual Development and Fellowship.,22,24
20197804,"Sound Vibration II Certification  8/ 17-20 , E. Northport,NY",22,11
20222050,Conscious Connections NYC,22,15
20238173,Intuition In Your Daily Life,22,5
20239215,Empaths Worldwide Unite : ) New York Meet-ups,22,12
20240217,Intro to Buddhism,22,17
20268800,"Ritual Tantra ~ Love, Sex & the Sacred",22,2
20269405,Happy Buddhists Chanting in the Bay Area,22,21
20277346,The Truth About Us: A Men's Circle,22,3
20289586,Against Mysticism,22,10
20302519,Meditation in Lower Nob Hill!,22,1
20304878,Meditation for Spiritual Awareness Downtown Chicago,22,1
20346104,Lability,22,5
20355578,Creative and Magical Women,22,13
20378399,Chicago J. Krishnamurti Dialogue Group,22,0
20387662,The Fourth Way: An Introduction,22,17
20395159,Tibetan Tones Transformation Series,22,23
20415552,Magical Training Group,22,14
20418428,Preparing-the-Mind-Body-for-Race-Relations,22,0
20476539,Artist Way Class,22,4
20481052,Socialize & Network Mixers and Parties,22,12
20489982,Meeting in Silence,22,2
20512222,Unity In Harlem,22,20
20514764,Pretty Drugs: SF,22,19
20568999,MediSounds Sound Meditation,22,1
20631990,"Warm Souls,We are Empaths and HSP's!",22,7
20632034,NLP Neuro Re-Patterning/Get un-stuck. have the life you want,22,0
20632385,Clarity and Purpose,22,0
20632477,AGAPE NYC,22,1
20677297,Reiki For All NYC,22,16
20692098,Creation through Law of Attraction,22,9
20771843,Imagina,22,17
20796802,NYC Knowledge Book Reflection Focal Point,22,23
20820185,Anthroposophy NYC,22,22
20935646,Bay Area Sound Healing,22,16
20953547,The Healing Heart,22,1
21030666,Reiki Healing Lights,22,3
21035240,New York Conscious Professionals,22,5
21084997,Pali Canon Sutta Based Buddhist Sangha,22,16
21150934,Bay Area Astrology Study Group Meetup,22,18
21209945,Joy Ease  Success!,22,10
21210516,New York Reiki Meetup,22,1
21250948,San Francisco Center for Spiritual Living Meetup,22,6
21264311,The New York Deja Vu Group,22,3
21326882,SF Interior Alchemy:Psychic Development for Self Empowerment,22,0
21342032,Soul Path Studio,22,12
21602015,San Francisco Nonprofit Meetup,22,4
21602046,Open Death Conversation: An Evening Gathering,22,22
21634501,Sri Nisargadatta Maharaj study group,22,11
21679300,Melanin Magic,22,3
21699565,2017- The Year of Self-Empowerment,22,6
21707096,Resting Hands - Lower East Side,22,20
21714331,Empathic Leaders Rise - San Francisco,22,3
21725591,Chicago Truth Warriors,22,6
21744257,Earthscape Art with Andres Amador,22,14
21768765,"Oneness Meditation and events in NYC, Conn,Penn,New Jersey",22,19
21779150,"Energy Geek - San Francisco, Oakland, Berkeley",22,13
21823003,San Francisco 'Earthing' Meditation Group,22,20
21910662,Mindfulness and Compassion,22,2
21982047,MORE - Mastering Our Resourceful Energy,22,18
21983066,Italy's Witches and Medicine Women with Karyn Crisis,22,3
22016240,New York Law of Attraction Meetup,22,17
22034166,Soular  Charge  Station,22,9
22054087,Divine transmission through open eye meditation,22,15
22076014,"More Than Just Talk: Equality, Justice, Faith & Spirituality",22,12
22141913,New York Yoga & meditation,22,22
22150087,Divine Consciousness Energy Technology,22,16
22189683,Chicago Sound Therapy & Healing Meetup,22,16
22197384,"New York Sound Healing, Yoga Nidra and Meditation Meetup",22,22
22291811,The Activated Life,22,7
22293456,Exploring the Tools of Access Consciousness,22,19
22359529,Spiritual But Not Religious Prayer Group,22,10
22428947,Reiki with Angela and Kristin,22,20
22503770,Love City Arts Collective,22,9
22591029,Intuitive Art Making,22,11
22768793,Hue 'n' I EARTH ANGELS,22,9
22841590,New York Love Corner,22,20
22879701,Psychic Medium Development Meetup,22,6
22919652,New York A Course In Miracles Meetup,22,17
22925460,Transformative Living in the Heart of the Labyrinth,22,13
22936683,New York Hypnosis Practice Group Meetup,22,6
22977320,We R Human,22,14
22984984,Chicago Astrology Study Group,22,20
22985944,Conscious Creators of New York,22,24
22999849,Healing Vibrations NYC,22,13
23031929,Mankind Pride NorCal,22,23
23108514,Lifebook   Your How to do Life book,22,9
23127657,Spiritual Gangstas,22,20
23219481,MEDITA New York / Meditation for the Collective,22,14
23221365,Girlfriends (30s): Spiritual Book Club & Random Fun,22,9
23232409,Meditation on Tuesdays at Rat Park,22,24
23245599,Witchy Women,22,7
23247218,"The Art of Energy Healing, the Jin Shin Jyutsu Way",22,23
23260179,Everything is Always Working Out For You,22,5
23271019,Meditation Made Simple with Conscious Rise,22,8
23286176,Learning Witchcraft NYC,22,18
23319687,NYC Group Reiki Healing and Meditation,22,16
23332686,Learning about Life from Animals,22,6
23345331,Empath Support Gatherings,22,18
23353412,Flat Earth International - Chicago,22,12
23365845,An Evening of Messages From Spirit With Medium Pardis Partow,22,16
23367572,San Francisco Consciousness Meetup,22,22
23368245,"Deer Spirit Healing, Awakening & Ascension Meetup",22,5
23384611,Bay Area Drunken Degenerates,22,8
23394711,Step Up Your Game,22,7
23430488,Awakening Circle,22,10
23444895,New York Earth Angels Meetup,22,14
23449318,Sound Vibration Healing Sessions Tri-state area,22,16
23473432,The Phenomenon and The Gift - Chicago -,22,14
23548098,Yoga: Uniting East and West;,22,0
23550344,Yoga: Uniting East and West,22,13
23554451,Athella channeled by Christina Hill (New York),22,0
23570603,Self-Awakening: Past Lives Regression and Quantum Healing,22,6
23588607,MERAKI MAGIK,22,16
23660758,kid icarus,22,22
23684006,Wake Up Now ! The World is waiting for YOU,22,4
23704370,Concious Dance Collective,22,19
23711923,"Apple Isle Grove, ADF",22,19
23742493,Chicago Rosicrucians - Nefertiti Lodge,22,24
23750890,The New York Law Of One/Ra Material Meetup Group,22,4
23872259,Tarot Workshop at Quest Bookshop,22,10
23900425,Spiritual Conversations @ Mist Cafe,22,14
23983801,Shaolin Nei jing Qi Gong,22,3
24069946,Cancer Support Group at Burilingame,22,20
24130058,How to read Tarot Intuitively without knowing?,22,18
24267049,Sacred Plants & Entheogens in San Francisco,22,5
24300282,New York Self-Realization Meetup,22,7
24320938,Sensual Embodied Awakening Bellydance,22,16
24322794,Reiki ~ Purple Fish Healing,22,3
24358242,Extreme Shamanism NYC,22,20
24362951,Chicago and Northshore Kabbalah Lectures and Events,22,10
24417191,Infinite Possibilities Training,22,14
24486952,Transcendence NYC,22,4
24503220,San Francisco Spiritual Psychology Meetup,22,16
24563464,New York Conscious Community-building Meetup,22,9
24650410,Intentional Creation through Law of Attraction,22,11
24669526,spiritual medicine group,22,7
24734163,New York Consciousness Meetup,22,11
24740903,New York City Braco's Voice Group,22,11
24751963,Darshan with Satyaprem NYC 2017,22,16
24799353,Meditation and Healing with Emily Wallace,22,8
24819571,Urban Mystic Gathering,22,18
24833918,The Chicago Seth Material and Creativity Club,22,1
24848112,Community of Silo's Message  Manhattan,22,23
24868575,San Francisco Hiking and Meditation for Holistic Women,22,5
24880172,Jeff Jones,22,11
24881553,New York Taurus Zodiac Sign Meetup,22,14
24929574,New York Witches Meetup,22,23
24929995,Spiritual Search in Contemporary Life,22,13
24934140,Bay Area Vipassana Meditation Group Sit and Dinner,22,18
25037342,San Francisco Kabbalah Meetup,22,7
25040809,New York Transformation Meetup,22,12
25059013,Spring Forest Qigong Practice Group,22,21
25106635,New York Energy Astrology Meetup,22,15
25171654,Chicago West Loop - Inner & World peace Meditation Meetup,22,4
25341450,New York Self Care for Women,22,12
25349575,Mill Valley Holotropic Breathwork Meetup,22,7
25366627,New York labyrinth walk and meditation Meetup,22,11
25429053,Sound Healing and Virtual Reality,22,7
25442377,Self Love: The Path of Totality Workshop,22,2
25446063,Occult Meetup Group,22,6
25451249,Silo's Message Ceremony,22,18
25466152,Manhattan Zen Meditation Socials,22,4
25474833,Astoria - meditation for personal & social transformation,22,11
25481291,Opendoorseancegroup,22,23
25497037,How To Reprogram Our Brain To Achieve Our Dreams,22,4
25515736,"Chant, Pray, and Sound healing for Peace, Love, and Harmony",22,7
25550723,New York Feng Shui Consultant,22,4
25554441,The Aquarian Man...,22,2
25635321,Free Chakra Meditation Classes @ Irving & 19th,22,3
25654787,San Francisco Life Transformation Meetup,22,4
25664521,Chicago Spiritual Growth & Life Transformation Meetup,22,22
25685373,SF Introduction to Meditation & Career Success Meetup,22,17
25697776,New York Reiki Meditation & Relaxation Circle,22,1
25711804,Italy's Witches and Medicine Women: Healing Demonstration,22,3
25767124,Womb Awakening Workshop,22,4
25774315,Discovering Mantra Yoga,22,21
25804157,Chicago Self-Improvement Meetup,22,1
25806136,Eric Butterworth - Discover The Power Within You,22,22
25826394,ASCENSION CIRCLES NYC,22,23
25829958,Free Intro to Meditation - Learn how to still your mind,22,0
25838869,Spring Forest Qigong at Reflections Yoga,22,23
25873295,Free Meditation Classes - Buddhist Mysticism in the Mission,22,17
25882847,San Francisco Personal Development Meetup,22,12
25897104,New York Jewish Spiritual Exploration,22,6
25925320,NYC New Thought - Transformation Group  W 84th Street,22,14
25925500,VortexHealing Group Healing and Clinic,22,17
25959288,Time In,22,20
25972037,Opeen Doorway Seance Group,22,23
25974428,Open Door Seance Group,22,13
26014296,Cosmic Elevation,22,10
26018495,ENERGY HEALING BODY MIND SPIRIT FROM PAIN WORRY STRESS PTSD,22,13
26035064,SF Mystic Scuba Diving Meetup,22,22
26038444,Circle of Friendship with Jorge Luis Delgado Meetup,22,23
26049932,The Intenders of the Highest Good Meetup,22,7
26051783,San Francisco The Internal Work Meetup,22,16
26089064,San Francisco Mechanics of Consciousness Meetup,22,14
26098654,New York Spirit and Demonic Communication Meetup,22,16
26130335,Death Positivity Chicago,22,0
26139969,Chicago AGEAC Meetup,22,6
26140834,Ayahuasca Meetup,22,21
26143000,NamasGAY SF: Spiritually-Minded LGBT Meetup,22,20
26143089,New Reality Community: For our Future Meditation and Tantra,22,16
26150917,New York Angels Healing Meetup,22,2
26165448,North Mountain Zendo,22,8
26186589,Lightworkers Empowerment,22,19
26196403,Enlightenment For Women - Meditation Seminars,22,7
26197758,The NYC Hypnosis/NLP Practice Group,22,14
26222062,New York JourneyDance Meetup,22,11
26250504,satsang with reflex maya,22,22
26263258,Lighthouse Workshops,22,1
26277387,Twin Souls NYC,22,2
26320702,"Bufo Alvarius, Kambo, Ayahuasca, Wachuma. Sacred Plants",22,4
26323892,How to Improve Yourself and Be More Useful to the World,22,24
26341180,Women's Circle with the Divine Feminine,22,18
26371769,The Curious Spirit Soul Circles,22,8
12907,New York City Atheists Meetings,28,22
26154,The Chicago Freethinkers Meetup Group,28,22
26217,The New York City Brights,28,23
56947,The Chicago Ex-Jehovah's Witnesses Meetup Group,28,6
76809,The New York City Hinduism and Buddhism Meetup Group,28,4
115482,The TriState Pagan Community,28,23
125245,The New York City Progressive Muslim Meetup Group,28,16
146584,The New York City Eastern Spirituality Meetup Group,28,10
214927,Ethics and the Arts,28,17
227880,Secular Humanist Society of New York,28,17
232540,The Quran Discussion Group,28,3
338540,New York Shamanic Circle,28,11
349090,Gotham Atheists,28,6
419600,"Church of Azazel proto-congregation, New York City",28,9
431480,New York Society for Ethical Culture,28,10
437768,Middle Eastern Music Ensemble (Sufi & Folk Music),28,22
448750,The New York City Skeptics Meetup Group,28,9
459883,Bay Area Atheists/Agnostics/Humanists/Freethinkers/Skeptics,28,8
460049,Flying Spaghetti Monster Meetup,28,5
471824,Immanence,28,18
475041,The New York Halloween Meetup Group,28,7
487781,Chicago's Secular Singles,28,2
491714,The Catholic Fellowship of NYC,28,22
496984,Charmed By Starr Witches of New York Meetup Group,28,0
516047,Center for Inquiry San Francisco,28,12
558133,The Chicago Free Inquiry Meetup Group,28,17
559463,Center for Inquiry-New York City,28,0
561090,Guardians against the Tyranny of Fanaticism,28,1
623547,Shiviti Drum Circle,28,14
756167,Allied Non-Believers United- The Reality Union,28,24
936773,Buddhism and Happiness Meetup,28,8
1065134,The New York City Drinking Skeptically Meetup,28,22
1075787,The Chicago Transhumanism Meetup,28,2
1122952,Christian Social Network!   Creating bonds thru fellowship!,28,3
1186906,FAITH HOUSE Manhattan,28,21
1240855,San Francisco Pagan Meetup Group,28,22
1312646,Formerly Fundamentalist NYC,28,9
1331341,Rissho Kosei-kai Buddhist Church of New York,28,2
1345027,Vipassana Meditation in NY & NJ (as taught by S.N. Goenka),28,7
1347772,Asian American Christians & Friends,28,4
1402796,The Chicago Latino Atheists Meetup Group,28,8
1431259,Let's cast spells 45+,28,13
1460619,The NYC Christian Social Group,28,17
1507125,The City Congregation for Humanistic Judaism,28,23
1535413,Holy Trinity Parish - Community of Roman Catholics - NYC,28,14
1568618,Reasonable New York,28,6
1580522,NYC - No God? - Know Astronomy Instead!,28,10
1584300,Lilith's Tribe in New York City,28,13
1624198,Bay Area Humanists,28,13
1700984,NY Christians & Friends,28,1
1703354,NYC Bible Groups,28,0
1710114,San Francisco - Manjushri Lineage Buddhist Group,28,10
1745408,Christian Singles Mingle,28,14
1746775,Support Group for Christians in Fashion,28,18
1746973,The Jolly Thirteen Club,28,0
1798161,NYC Grailwood Coven - Open Events,28,15
1806922,"Messianic Believers In The Bay Area,CA of Y'shua (AKA Jesus)",28,7
2209651,Hollow Bones Rinzai Zen,28,11
2427722,Shantideva Meditation Center,28,3
2475162,NYC Faith+Tech,28,12
2598312,Buddhism of Four Noble Truths,28,4
2968752,Northwest Chicago Catholics,28,20
3050482,Friends & Former JW,28,11
3100682,People of Color Beyond Faith,28,7
3104922,Adventures in Humanist Ideas,28,22
3182172,Love-Works: Connecting Christians in NYC,28,4
3213412,Wheaton Bible Church Singles,28,6
3216712,The Science AGAINST Evolution!,28,9
3216812,Community of Passionist Partners,28,0
3260522,Downtown Chicago Bible Study Group,28,8
3701682,Rigpa New York City,28,2
4121292,Muslim-ish of NYC,28,23
4327402,Immanuel Community Church,28,11
4573492,I'm a Jew Yorker,28,14
4594942,The OFFICIAL NYC PAGAN PRIDE PROJECT MEETUP,28,10
4632322,Lincoln Park Christian Fellowship,28,2
4838912,NYC Shrine of Prometheus,28,13
5025552,Interfaith Chicago,28,21
5035262,"Gay Catholics, Christians & Friends - Social Group",28,21
5333152,Church in the Loop Bible Study,28,21
5483602,"Exploring New Ideas in Morality, Politics, and Culture NYC",28,7
6954352,Hebrew Israeli Karaoke in NYC,28,19
7009672,"Jewish Singles - 30s, 40s & 50s",28,24
7115542,Jewish-Singles-NYC,28,20
7552682,Islam Curious:The perfect way of life,28,2
7859162,San Francisco Area Recovering/ed Religious Nuts,28,3
7972962,Sisters of Islam,28,3
8100562,Bible Study on Deeper Questions,28,3
8847372,Bay Area Christian Technologists and Entrepreneurs,28,10
8867622,Feminist Freethinkers of NY,28,23
9106692,Knish and Learn - San Francisco Downtown Torah Study,28,7
9474332,Sunday Assembly - NYC,28,10
9503782,The Jewish Social Group,28,9
9541512,Abundant Life Transformation Seventh Day Sanctified Church,28,0
9907302,West Rogers Park Theology Pub,28,17
10108852,New York Buddhist Church,28,15
10830082,THE TABLE SF | a growing community church in SF,28,20
11160092,Sufi Study Center,28,3
11304032,Humanist Society of Metropolitan New York,28,10
11380102,Jews For Fun NYC,28,15
11548092,Empowered Christian Singles,28,6
11915722,"Faith, Fun, and Social Justice",28,22
12324092,Charla Biblica SFBICC,28,17
12673622,Ex-Muslims of North America - Chicago,28,2
12738232,JCC 20s-30s Jewish Social Meetup,28,23
12757172,Ex-Muslims of North America - San Francisco,28,21
12930932,God Talk Chicago - Theology for the Masses,28,7
13259352,Hekates Sacred Temple-Torchbearer of The Crossroads,28,8
13382382,Chicago Ben Noach Study Group,28,12
14940282,NYC Catholic Families,28,20
15654262,Ex-Muslims of North America - New York City,28,24
16041172,South Loop Christian Fellowship,28,7
16336102,San Francisco Jewish Social Meetup,28,4
16349412,LUCKISM PHILOSOPHY PROJECT,28,14
16442922,New York Millennial Muslims Meetup Group,28,6
16607672,San Francisco Singles Ministry Bible Talk in Daly City,28,6
16992482,Christian Young Professionals - NYC,28,5
17362792,West Harlem Bible Study,28,9
17932222,Hope Hill,28,1
18054362,Edgebrook Lutheran Church 20's/30's,28,18
18181423,NYC Muslim-Jewish Meetup,28,21
18228471,UU-Humanists,28,13
18410856,Matzo Fun Travel,28,20
18444835,Co-Creation Church: Come Build the Church You Want to See,28,1
18559533,Christian Social Group of NYC,28,8
18656555,Muslim Reform,28,21
18694457,St Mary's Meetup Group,28,19
18719899,Do Ngak Kunphen Ling (DNKL) Tibetan Buddhist Center,28,21
18723924,Bay Area Indian Muslims,28,7
18724954,Manifesting Miracles:Walking in Kingdom Power Today,28,6
18726442,Chicago Loop Christian Women's Group (20s/30s),28,15
18736587,San Francisco Bay Area Single Jewish Parents Meetup,28,19
18941264,Islam Chicago,28,21
18958641,"AMS (ARTS, MEDIA & SPORTS/ SPOKEN WORD) BIBLE TALK",28,14
19005978,Bible Discussion Group NYC,28,4
19086019,New York Buddhist Lotus Light Ceremony Meetup,28,21
19120712,Chicago Area Adventist Young Adults,28,24
19123746,San Francisco Spirituality Meetup,28,3
