group_id,name,category_id,monthly_fee_USD$
501410,Chicago Area Chamber Musicians Meetup Group,21,0
529523,Bay Area Classical Music Meetup,21,8
535652,"The VOCAL BRILLIANCE Group: Singing, Performing, & Education",21,5
588720,The San Francisco 80's Music Meetup Group,21,12
608833,The New York City Drum & Bass Meetup Group,21,17
715618,The Chicago Drum Circle Meetup Group,21,4
774036,The San Francisco 20's & 30's Indie Music Group,21,3
778318,The San Francisco Middle Eastern Music Meetup Group,21,7
814750,The San Francisco Metal Meetup Group,21,15
878144,---- SET FOR DELETION ----,21,10
882009,Chicago Classical Music Events,21,3
891667,The Chicago Opera Meetup Group,21,15
893386,Global Hip-Hop FAM,21,10
918090,The New York Chamber Music Meetup,21,2
976696,NYC BLUEGRASS SLOW JAM (for Adv beginners and Int players),21,24
1001619,Amateur Classical Musicians Association,21,0
1105895,The San Francisco J Rock Meetup,21,13
1180222,KARAOKE DANCE PARTY,21,14
1222759,RHYTHMflow  Explorations,21,21
1230591,Live Jazz (& Blues) Meetup Group,21,10
1230734,NYC ROCK N' ROLL DANCE PARTY SINGLES,21,9
1240279,The New York City Live Music Meetup,21,21
1326081,The San Francisco Indie Music Group,21,0
1369760,80's R BACK Karaoke,21,21
1387415,NYC Guitar Group,21,12
1444093,Trance Mansion,21,2
1451147,The Art Song Preservation Society of NY,21,2
1452348,Make Music Mass Appeal : Guitarists Invade Union Square!,21,14
1486060,Workingman's Dead Jam,21,21
1495269,Chicago Sacred Harp Singing,21,23
1518061,Digital Music NY,21,20
1524977,Vocal Breath Support Mastery,21,11
1528165,New York NoteWorking Meetup,21,21
1536410,The NYC Vinyl Meetup,21,0
1536748,NY Concert Meetup,21,1
1567339,Jethro Tull,21,5
1573337,SF Bay Area Music & Sound Healing Group,21,22
1573627,San Francisco Classical Guitar Society,21,8
1578394,Chicago Harmonica Meetup,21,16
1585433,NYC Guitar School Open-Mic For Beginning Performers Meet-up,21,8
1586477,The SoundSpace! Music Studio,21,19
1590069,San Francisco Karaoke League and Events,21,10
1591098,Riverside Choral Society (New York City),21,12
1596816,New York Social After Work Club,21,16
1596980,New York Piano Group,21,5
1625447,Live Music San Francisco,21,8
1629159,NYC SuperCollider,21,8
1639189,DJ Club SF,21,2
1663085,djembe drumming group,21,8
1663708,"SF Bay Area Cool, Funk, & Smooth Jazz Meetup Group",21,7
1687516,San Francisco Sings,21,0
1694184,"!!Classic Rock, NYC!!",21,21
1731425,Chicago Guitarists,21,4
1735610,Healthy Living Chicago,21,1
1740409,San Francisco Soul Music Group,21,6
1741277,"Revolutionary Vocal Training for Singers, all levels",21,5
1744183,NYC Open Mics and Performances,21,9
1746178,San Francisco Guitar Lessons with Carrie Love,21,20
1746189,Songwriting!,21,16
1751603,Christmas Carol Singers,21,11
1752350,SOMETHING TO SING ABOUT IN NEW YORK,21,22
1759622,Classical Music Friends in the Bay Area,21,15
1761852,Synths & Samplers (Chicago Hip Hop Producer's),21,12
1768471,Chicago concert goers,21,4
1776316,Bay Area Britpop,21,0
1787358,San Francisco Ukulele Rebellion!,21,4
1788816,Folk Music NYC,21,21
1803833,Happy Hour Guitar,21,12
1807639,We Band Together,21,13
1821156,NYC Electronic Music Producers,21,11
1949531,NYC OPERA MEETUP,21,4
2122721,The New York Singer Songwriters,21,10
2132291,Music Makers of New York,21,10
2269571,immaculate electronica NY,21,12
2299781,New York City Classical Guitar Society,21,24
2375541,irish music trad session,21,10
2499682,Sing for Your Soul! (New York),21,15
2643282,Janelle Jazz With U Lovers International,21,6
3154692,Northside Pickers and Bluegrassers,21,6
3430222,Rock and Roll Book Gig - Official Site,21,23
3430572,"Extra Fly: Hip Hop, Reggae, Soca Music Club Night in SF",21,21
3657672,Carnegie Hall & Lincoln Center Concertgoers,21,11
3751052,NYC Jam,21,2
3778962,Chicago Heavy Metal Group,21,3
4146722,"Eat, Drink & Sing !",21,12
4148382,"Gotham Rock Choir: NYC's Pop, Rock & Soul Choir",21,12
4241082,NYC INDIE MUSIC - House Concerts!,21,19
4327862,Chicago Tabla meetup,21,15
4393862,Mobile Music Meetup,21,16
4561432,Sound and Machine,21,11
4821292,SF Rockers' Club,21,20
4871442,Sunday Singalong,21,17
5286722,Music Tech,21,20
5349192,NYC R&B/Soul Society,21,4
5690922,Bay Area Gay Spirit/Flesh and Spirit Queer Men's Drum Circle,21,14
5968852,San Francisco EDM,21,9
6094092,Advanced Audio + Applications Exchange (A3E) - New York City,21,18
6431622,Buskers Worldwide,21,18
6472872,Chicago Taiko Meetup,21,1
6650352,Tune Up!,21,8
7342462,The NY Metro Neo Soul Clientele,21,6
7359202,"NY I Love To Sing Community Jams, Choir and Gatherings",21,11
7428542,Let's Meetup and Play Piano!,21,14
7616062,NY Tech(no) Dance Party,21,19
7643482,Drum Circles in Chicago:  Declare a drum circle,21,9
7890742,Experience Your Soul's Energy Through Singing,21,20
8019162,Let's Read Classical Chamber Music!,21,0
8027072,Life Out Loud!,21,8
8403962,Eliane Delage Guitar Ensemble,21,19
8417062,SF Ableton User Group,21,10
8590012,"MUZAMI (House, Tech House, Techno Show Meetup)",21,13
8881982,Hit Songs Deconstructed,21,7
9218642,Chicago Contemporary and Modern Music Interest Group,21,2
9290802,Bay Area Amateur Pianists,21,11
9658672,"Chicago & Global Dancing, Clubbing & Electronic Music",21,22
9827662,New York City Music For TV & Film Meetup Hosted By LH Media,21,19
9849892,Bluegrass Jams hosted by the Westside Irregulars,21,7
9902072,The Electronic Music Producers,21,22
9965262,Electronic DJ's and Producers,21,10
10719152,Music Without Borders,21,22
10768822,New York City Electroacoustic Music Society  (NYCEMS),21,22
10854002,"Gypsy Jazz, Flamenco and Beyond Jam",21,10
10917332,Community Renewal Chorus,21,8
11066062,JayDub's Rave Crew,21,8
11375852,Westside Jazz Club,21,11
11495032,NYC Open Mic Club,21,16
11527022,New York City Grateful Dead Song and Jam Meetup,21,15
11606052,OLD SCHOOL KARAOKE            (The oldies and the standards),21,6
11696362,Poets & Composers Salon,21,18
11806582,Chicago Amateur Pianist Guild,21,14
12058592,"The Classical Musicians' Rehearsal Symphony Orchestra, LLC",21,4
12064552,Chicago Indie Music Meetup,21,21
12125382,Pro Musica Musical Evenings,21,8
12261142,Beatles Music  Jam,21,7
12469962,SingApplause! ~ An Open Mic for Singers,21,19
12790262,Bay Area Early Music Meetup,21,9
12798422,"Voice Class for Actors and Singers, (Mid-Town)",21,24
13058512,Funkadelic Studios,21,16
13069742,NYC Synthmeet,21,17
13389272,Classical for All,21,13
14024532,TGFK - Too Good for Karaoke,21,1
14422152,Windy City House Concerts,21,3
14583012,The SF House Music Group  Deep | Funky | Electro | Tech ,21,16
14651022,SoundCloud Chicago,21,18
14783972,Composing Film/Game Music SF,21,8
15499122,Gotham City Dark Arts,21,22
16299062,New York Live Jazz Meetup,21,19
16390892,NYC House and Techno Music Meetup,21,18
17091782,NYC JavaScript++ Karaoke,21,11
17274962,,21,7
17297202,New Yorkers Who Love Bluegrass Music,21,0
17909602,New York Session Symphony,21,11
18186938,Turtle Bay Free Community Concerts,21,4
18193295,San Francisco Women's a-cappella chorus Meetup,21,24
18231242,"TradMaD Camp, Traditional Music and Dance Camp",21,9
18252759,Harlem Jam Session Meetup,21,13
18296487,Logic Pro User Group (SF Bay),21,4
18303000,Free Live Jazz in New York City,21,2
18327942,20th Century Classical Music concerts Meetup,21,14
18375645,NY A Cappella Jazz Singers meetup for good sight readers,21,16
18383318,NYC Logic Pro/Garageband DIY Music Production Meetup,21,3
18383769,Intro to Voice Training -- NYC,21,22
18408344,NYC Brass Ensemble,21,6
18409895,NYC Songwriting Meetup,21,23
18475971,CircleSinging NYC Vocal Improvisation Meetup,21,12
18496927,Disco Lives in NYC,21,15
18497502,Ukulele Jam and Sing,21,13
18510062,New Yorkers who love Cajun Music,21,7
18510088,Let's Talk Music NYC Meetup,21,18
18529820,This is a live music pay team test,21,8
18554861,Rock and Effect (NYC) - Go to Awesome Local NYC Rock Bands,21,4
18584861,San Francisco Acoustic Jazz Session Meetup,21,11
18593339,"Fabri Fibra & Clementino Iena White (Rapstar) Fans NY, NY",21,7
18685651,San Francisco Acoustic Jams Meetup,21,12
18691003,SF Bay Area Acoustic Guitar Society,21,16
18694795,Composing Film and Game Music NYC,21,0
18703347,Artists Meetup,21,11
18751565,SF Music Producers + Songwriters,21,2
18772514,Ocean Beach Social Club At Kawika's,21,1
18800320,For the Love of Ghazals,21,22
18857549,New York Ballet & Opera Meetup,21,1
18885897,Chicago Vocal Jam,21,9
18897526,Wannabe Music,21,15
18902608,Garfield Park Conservatory ~ Music Under Glass,21,9
18910784,Starting a Great Band,21,13
18946222,Saint Benedict Parish & Community Choir,21,23
19003294,Chicago County Music,21,17
19041096,New York City Allman Brothers Band Song and Jam,21,9
19046161,New York Songwriters Collective,21,1
19105857,Female Musicians of Livonia,21,23
19110817,New York Live Jazz Music Meetup,21,21
19195029,Summertrios Chamber Music Concerts in NYC,21,2
19232468,Chicago Beatbox (CBB) Meetup,21,13
19252572,"NYC Live Jazz Meetup: Live Jazz, Dinner And Discussion",21,21
19339919,Fun & Exciting Things To Do In NYC,21,10
19345772,NYC Guitar Lovers Open Mic,21,8
19357896,Live Acoustic Music Chicago,21,4
19429378,NYNJ  Classical Music Meetup,21,5
19461697,San Francisco Guitar Concerts,21,2
19542446,Electronic Open Mic,21,3
19566279,Electronic Dance Music(EDM) EVENT Meetup in NYC -Tristate,21,11
19581359,Dance University,21,6
19609322,Girls Rock! Meetup,21,4
19662893,New York Rockers,21,21
19768901,Funkadelic Studios 1st Thursday Funk Rockout!,21,12
19782345,San Francisco International Karaoke Meetup,21,10
19783032,Anything Goes Chorus Meet Up,21,3
19812422,New York Christian Musicians Meetup,21,2
19828884,NYC Jazz Aficionados,21,19
19830830,Chicago's ALPHAbar Karaoke League and Events,21,7
19874815,New York Live Music Meetup,21,1
19881805,Hamilton Sing Along,21,9
19884322,Synchronize: DJ Controllers,21,24
19925680,PianoForte Piano Performance Meet Up,21,20
19948522,Live Music and Arts in Chicago (L'MAC),21,22
19969167,NYC Music Producers Club,21,5
19972022,Record Union Music Makers - New York,21,23
20010691,Women's Drum Circle at herchurch,21,5
20031044,Asian American Musicians Chicago,21,22
20031122,Sing choral rep SF,21,9
20042479,Latin Music Concerts and Classes at Community Music Center,21,23
20046962,TGFK 2 - Too Good for Karaoke,21,19
20058831,Caribbean Friends of NYC,21,15
20069775,Chicago Area Shakuachi Group,21,21
20073616,International Brazilian Opera Company,21,7
20121865,New York Solo Piano Meetup,21,6
20142785,San Luis Obispo and Beyond Unique Music Concerts,21,18
20149148,CHI-ROCK EN ESPANOL MEETUP,21,8
20192636,No Pangolins,21,6
20198383,Outdoorsy Musicophiles: Alt/Indie Music & Hiking Fans,21,17
20306283,Freaky Awesome Shows,21,12
20343966,Retro Bollywood Music Lovers Group,21,14
20344035,Men's A Cappella - Who Wants To Sing,21,19
20397023,San Francisco Nightlife Meetup,21,13
20425557,The Karaoke Workout,21,6
20451353,SF Music Producers,21,23
20464855,San Francisco Flute Choir meetup,21,9
20465426,New York SoundWalkers,21,19
20512670,New York Music Publishing & Licensing Meetup,21,18
20642139,New York Blues Jam Meetup,21,10
20707268,New York Music Business,21,2
20742987,"New York Neo Soul, Deep/Soulful House, old school rap lovers",21,19
20749067,Recreation Sound Systems: Renegade Rendevous,21,17
20951612,Meet Eighth Blackbird!,21,4
20973803,TheVR Group,21,21
21029493,Music Is Good Medicine at UCSF,21,9
21163975,San Francisco Phish Meetup,21,23
21163992,San Francisco Public Radio Meetup,21,3
21188939,New York Karaoke Meetup,21,7
21263181,Holiday Caroling in Union Square!,21,7
21339198,The Acoustic Coalition,21,5
21443470,Big Apple Chorus,21,10
21510216,NYC Jazz Musicians Hang,21,0
21542025,Gypsy Jazz NYC with Luke Hendon,21,1
21548640,NYC Jazz and Fingerstyle Guitar,21,14
21628234,The Edge of NY,21,18
21670454,The North Eastern Violin Academy,21,10
21765090,FunTimeChoir!,21,20
21798092,NY Acoustic Song Circle,21,18
21875274,SF Guitarists,21,3
21972553,Chicago North Harmonica Meetup,21,3
22003936,San Francisco Digital Drum Circle,21,15
22037199,Chicago Greasers,21,7
22053606,Broadway & Showtunes Karaoke,21,22
22114649,Afro-Peruvian jazz music and drinks!,21,15
22182197,Live Country Music Fans!,21,20
22290467,Free Workshops: How to Become an Audio Professional,21,13
22308803,Harlem Artists - The New Renaissance,21,22
22569404,chamber music class at Greenwich House,21,0
22590439,Classic Album Sundays Chicago,21,23
22800522,We The People Theater Company,21,14
22834836,The Founders Blues Club,21,20
22873474,Music Art Commons,21,16
22909244,Mallus in Chi-town,21,10
22984679,Composing Film/Game Music Chicago,21,19
22985265,LiveTheBiz Event Group,21,22
23222533,Christian Group Vocal Lessons,21,21
23247086,Free Workshops: Vocal Development for Session Singing,21,7
23248472,New York Theremin Players Meetup,21,7
23273476,San Francisco Karaoke Meetup,21,16
23363359,All That Jazz,21,17
23443425,NYC Rock Bands and Fans,21,21
23459385,The Producer Table,21,1
23590480,San Francisco Drumline Meetup,21,10
23772204,Drum Spiral,21,9
23830511,Bay Area Classical Mandolin Lovers,21,10
23881618,Guitar Self Learning/Practice Meetup - SF,21,19
23916296,NYC Grooves and Melodies Jam,21,4
23959710,Art Voices Matter Presented By Creating Crimson,21,10
24012075,the Harlem House Project,21,21
24182630,Hathaway Brown School Vocalists at Metropolitan Room!,21,4
24282741,Tuesday Contact Improv Class and Jam at Counterpulse,21,15
24381003,Chicago Stoner Metal Meetup,21,6
24500261,Rue B Jazz Jam Sessions,21,22
24526403,Chicago Electronic Music Producers Meetup,21,3
24555653,Mad River Karaoke Wednesday's,21,0
24591826,San Francisco Classical Music Meetup,21,14
24650051,Veiled Waltz. Social club for eclectic adult entertainment.,21,17
24745405,Women who like Rock and Blues,21,1
24782870,Acoustic Guitar Players Meetup,21,0
24816089,"Fans of San Francisco Symphony, Opera, Ballet and More",21,22
24909860,Chicago World Music Meetup,21,7
24912138,"A Never-Ending Line, a female song cycle. IN CONCERT.",21,14
24943309,San Francisco Chamber Musicians,21,0
24950098,Drummers and Muscians of Chicago,21,13
24971709,Chicago A Cappella Meetup,21,22
25061268,Sangers Room NYC,21,12
25133632,"BAY AREA LIVE: Curated, amazing live concerts with friends",21,12
25133861,Keep Calm and Karaoke Wednesdays at Mad River Bar & Grille,21,15
25154622,Rave/ EDM Family NYC,21,3
25181023,Empire Pub Crawl NYC,21,3
25190467,Bay Area Reggae Lovers,21,3
25248919,Brooklyn Electronic Music Meetup,21,1
25280819,Centri Music Industry Network - NYC,21,13
25330101,World Of Wordplay Open Mic Events,21,20
25340961,Vinyl Listening Club!,21,1
25415427,UVA A Capella Alumni (NYC),21,9
25420039,Friends of Merit,21,12
25461863,New York amateur chamber music Meetup,21,5
25505182,"Voices in Flow: Music, Mindfulness, and Meditation",21,2
25505357,Play Some Music & Make Good Friends,21,12
25507349,Logan Square Open Jam Session,21,9
25517368,Acoustic Songwriter Performance Acuity (ASPA),21,9
25590045,NYC Pocket/Groove/Dope Tunes Jam Group,21,4
25636758,Chicago Instant Album,21,6
25687739,Chicago Music Meetup,21,0
25696853,3 Mics Thursdays - Live Music Series,21,21
25697521,Alphabet City Music Workshops,21,13
25699446,Singing in Harmony - women,21,5
25709059,Maya's Thursdays,21,2
25720867,SF BAY-AREA VIOLIN [PRACTICE] GROUP [ALL-LEVELS],21,22
25726670,Singing in Harmony - Men,21,8
25728593,Chicago Wind Ensemble Meetup,21,18
25807686,Rolling Through Life-physical Disability meetup,21,7
25824829,San Francisco Musicians,21,17
25905945,San Francisco Resistance Music Meetup,21,6
25915223,Music Mania Manhattan! (Classical Music Lovers & Players),21,8
25939739,Live Music Saturday Night New York,21,6
26009021,Hanging Out (with EDM People),21,16
26028510,San Francisco Live Music Meetup,21,3
26053931,Passionate Concert Goers,21,9
26081151,Music Industry San Francisco,21,10
26093939,Music Industry Chicago,21,12
26128828,Unity Singers concert,21,8
26130282,New York Whistling Meetup,21,19
26145156,Karaoke Cult NYC,21,18
26156939,South Suburban Chicago House Music,21,8
26160551,Black Alternative Live Music,21,18
26162150,Jazz Bass Enthusiasts,21,5
26175583,"concerts, music",21,14
26184256,Let's enjoy klezmer music!,21,14
26220929,The Jam Gym,21,18
26241733,New York Musicians Meetup,21,15
26253192,NYC Jazz Crawl,21,8
26309131,Music in Chelsea - Hidden Gem Concerts!,21,8
26315642,New York LatiNew Meetup- Brasilatin,21,7
26318181,Karaoke Social,21,16
26320944,Chicago Synthesizer and Electronic Instrument Magic,21,18
26322316,San Francisco Musicians Meetup,21,1
26330104,Rock Guitar,21,17
26364045,Rock Show 'Mos,21,14
62721,The New York City Foreign Service Meetup Group,6,7
72002,Greek Language & Culture Meetup (NYC),6,15
218094,"Prague Spring, NYC Chapter",6,9
275595,Chicago Science Field Trips,6,7
328570,The San Francisco Philosophy Group,6,21
333772,Chicago Skeptics,6,24
394905,Massimo's Philosophy Caf,6,3
398212,San Francisco Bay Area GMAT Tutoring (Free),6,16
414834,"#AAA.org & Darwin fans! Astronomy, Evolution, Science, NYC",6,9
499872,NYC Debate,6,23
657363,The New York Nonfiction Book Club,6,20
744262,Economist readers,6,10
804843,The NYC Physics and Astronomy Meetup,6,0
1085510,Ayn Rand: A Sense of Life,6,4
1117713,3 Topics Over Dinner,6,1
1280356,Top NYC Opportunities & Resources for MBA Professionals!,6,4
1288361,The New York City MBTI Meetup Group,6,22
1325945,Old New York Bars,6,9
1381471,United Nations Associations NYC,6,11
1382251,NYEdTech,6,19
1394455,Urantia Midtown NYC Study Group,6,18
1395722,"Ergo: discussions about rationality, philosophy and science",6,21
1409326,Humorous Toastmasters,6,2
1440018,The Northwest Chicago History Meetup Group,6,18
1456947,Seven Habits for the Highly Effective San Franciscan,6,8
1459657,Mathematics Academy Math Club - New York City,6,7
1470198,The Chicago Philosophy Meetup,6,16
1493522,SF Bay Area Geology & Natural Science Hiking Group,6,7
1559564,Ideologi New York City Meetup,6,10
1573972,"Less Wrong/Overcoming Bias, New York",6,20
1626947,Exploring the Illusion of Free Will,6,23
1665163,Lyceum: Philosophy Reading & Discussion Group,6,1
1696922,R080T$,6,5
1723784,Michigan Avenue Toastmasters,6,4
1755448,Math for Math's Sake!,6,22
1763231,The Actors Theatre Workshop,6,16
1765861,TEDxMeetup NYC,6,7
1780638,Art Appreciation and Philosophy,6,21
1784773,Immodest Proposals NYC,6,23
1799994,How To Survive And Prepare For Any Urban Disaster,6,7
1823535,"Freemasonry for Men and Women in San Francisco, California",6,15
2120261,NYC Socrates Cafe,6,23
2195371,NewSpace NYC,6,8
2349321,NYC Equitable Toastmasters Club,6,22
2373151,Dissertation Chicago,6,13
2592552,Cafe Philo New York,6,0
2627262,WhoseBrainIsIt,6,10
2775972,SFAR Toastmasters in the Civic Center,6,17
2825182,Deep Thinkers Round Table,6,8
2942732,Bay Area LifeTech (BALT),6,8
3196712,The Chicago Rational Future Meetup Group,6,12
3210542,Scientifically Social,6,10
3266712,Wonderfest Science,6,0
3371852,GGU Toastmasters Meetup Group,6,22
3379692,The Speak Easy: Public Speaking Group,6,18
3384402,BAASICS (Bay Area Art & Science Interdisciplinary Sessions),6,22
3483322,Philosophy-in-Manhattan,6,2
3863522,Educelerate Chicago,6,6
3958992,history group - dinner and  discussion,6,10
4041872,University of the Commons,6,6
4174372,Applied Psychology Meetup NYC,6,15
4299162,Read All About It! English Language NYC,6,4
4315362,The SF Henri Bergson & Friends Society,6,17
4332332,BayBio,6,23
4394892,"Traffic Toastmasters, NYC Public Speaking Club",6,2
4538322,Astonishing Hypothesis - science of consciousness meetup,6,1
4670762,Manhattan Art Book Club,6,10
4849852,Humanistic Interpersonal Meetup,6,5
4900962,Computer Access for People with Vision Loss,6,7
5516522,The Geographic Society of Chicago,6,15
5772502,Academic Writing Meetup,6,11
5796052,Society of Environmental Journalists NYC,6,18
5925702,Chicago Area Parents of Mensans Under 18,6,9
5963662,Conversations New York,6,1
5976752,The Enlightenment Book Club,6,5
6188902,Technology for Educators NYC,6,20
6258552,"IL Mycological (Mushroom) Assoc: Chicago-based Talks, Forays",6,14
6411192,"Manhattan Toastmasters - Learn, Speak, Overcome, and Achieve",6,3
6587892,Game-Based Learning NYC,6,8
6946702,Magic Sunrisers Toastmasters Morning Club,6,13
7459792,Life Hack NYC,6,19
7704812,Exploring NYC History and Neighborhoods,6,0
7855202,Impact Investing NYC,6,10
8007762,"Accent Workshop for Actors, Comedians, and everyone else!",6,14
8056592,Latin American Spanish  Discussion Group,6,12
8150612,Open to Change,6,0
8152742,Science & Nature,6,12
8165212,Roots of Judaism,6,15
8234722,ArtsEdTechNYC,6,7
8331952,Technology for Good,6,13
8392492,Manhattan Lectures & Conversations,6,5
8702802,Bay Area Philosophy Group,6,9
8906452,MetroNY AWIS Meetup Group,6,19
9004082,Jaunty - Enhancing our Social Intelligence!,6,24
9173882,Fullstack Academy NYC,6,20
9247932,Democratizing Analytics: Using Data to Improve the World,6,3
9403772,NYC WOMENFIX,6,1
9529022,Bay Area Clinical Researchers Networking Group,6,22
9586552,Genealogy and Family Tree Researchers,6,12
9683052,Public Speaking and Pitching Club for Entrepreneur,6,10
9801812,Chicago Area Public Speakers Association,6,1
9829222,Maptime SF / Oakland,6,5
9966182,The Dialectic: A NYC Discussion Group,6,10
10203032,Tours of Manhattan,6,8
10260602,Met Museum Galleries and Cafes Club,6,14
10400732,Culture and Mental Health NYC,6,15
10576832,The Fraunces Tavern Society,6,15
10883592,Graybar Toastmasters - Become a skilled speaker!,6,18
10934852,San Francisco Renaissance Toastmasters,6,12
10952242,"Mythology, Science, Art, and Storytelling in NY",6,9
11194812,Math and Algorithm Reading Group,6,8
11268332,The Ivy Plus Society: Chicago,6,11
11314242,San Francisco Salon,6,18
11340662,Theosophical Society in Chicago,6,23
11531812,Northeastern University NYC Metro Alumni and Coops,6,5
11560042,Chicago Biohacking,6,1
12193262,Leonardo Art Science Evening Rendezvous - LASER,6,15
12255482,Public Speaking & Improv Practice,6,13
12308652,The Metropolitan Society of Natural Historians,6,17
12655232,SF Bilingual Cantonese-English Toastmasters Meetup,6,17
12758552,NY Quantum Theory Meetup Group,6,4
12810782,EdTech Events in NYC,6,6
13037472,NYC Current Affairs Club,6,9
13271492,Chicagoland Healthcare Innovation Forum,6,4
13289652,American Decorative Arts Forum,6,10
14398962,Behavioral Economics Reading & Discussion Group @ NYC,6,4
14417522,Bay Area Babysitters & Nannies,6,11
14446252,Behavioral Economics Reading & Discussion Group @ SF,6,11
14491262,Sales Tools for Start-Ups and Small Businesses,6,3
14506892,NYC Self Improvement for Critical Thinkers WWW.NYSGS.ORG,6,15
14547622,Student Affairs Collective,6,24
14574992,Future of Hardware,6,10
14961792,Extreme Toastmasters (ET),6,2
15081142,Cognitive Lawyers,6,12
15250052,Applied Sciences Chicago,6,20
15436642,New York City Socionics Society,6,6
15502272,New York City Street Hypnosis Meetup/Training/Performance,6,0
15871072,Open edX and Open Source Educational Technologies,6,1
15944822,Festivus Enthusiasts,6,8
16437832,Caf News,6,1
16491612,6 Degrees To Equality,6,14
16795782,Farallones Sanctuary Explorations,6,0
16981742,iTeach San Francisco,6,24
17334612,Pub Theology : a public discussion on hot topics of the day,6,3
17538592,Greater New York Mensa Meetup,6,17
17815472,San Francisco After GMAT Drinks - MBA Application Info Share,6,19
18211172,Space Apps NYC,6,14
18239213,Polymath Conversations: Stimulate Your Creativity,6,20
18255343,Physics Enthusiasts NYC,6,5
18259947,CFA Study Group Meetup Chicago,6,20
18287255,Chicago Certified Public Accountants Meetup,6,10
18365750,Erfan-E-Halgheh & Your Specific Spiritual experience,6,21
18422485,New York Open Science Meetup,6,0
18463047,SPEDTech - NY Special Education Technology Meetup,6,22
18467768,Codesters Teacher Meetup,6,14
18511606,New York Astronomy and Astrophysics,6,9
18532042,HealthTech Women New York,6,8
18532559,Civic Socials: Baruch College Public Affairs Activity Group,6,3
18553227,Speaking Circle in SF ~ Touching Truth with Presence,6,19
18584199,CUNY Tech Meetup,6,2
18607415,NYC fMRI and fNIRS meetup,6,15
18625569,Effective Altruism Bay Area,6,8
18633180,"New York Science, Technology & Business Meetup",6,16
18639737,New York Educators and Teaching Professional Networking,6,0
18641650,Free English Classes in Midtown Manhattan,6,3
18699198,Innovation in Education NYC,6,19
18739605,Codecademy - Learn to Code,6,24
18752910,San Francisco INTPs and ISTPs,6,12
18795060,Sages SF,6,12
18797832,Chicago Institute for Healthcare Innovation,6,0
18798219,730 Toastmasters Club,6,14
18851929,New York Academic Writing Meetup,6,16
18890979,Biotech Networking (BioNet),6,0
18987601,The Tech People Bookclub,6,21
19006207,New York Adjunct Professors,6,23
19042529,Social Enterprise Cohort,6,17
19048145,"Chicago Nonfiction, Private Book Club",6,4
19072555,New York BioDesign Meetup,6,14
19075638,Manylabs: Science for Good,6,10
19076193,The Future of 21st Century Education : SF Chapter,6,20
19095057,New York Big Bang Discussion,6,2
19100228,GMAsTers - NY GMAT Study Group for Aspiring 99 Percenters,6,13
19102419,SF Behavioral Science Enthusiasts,6,2
19107497,Bay Area Comparative Religious Studies,6,19
19132182,New York Contemporary & Historical World Events Meetup,6,18
19150042,ECUSA-NY: Divulgacin cientfica/Science outreach,6,24
19155551,SF/Oakland Cross-Cultural Solidarity Discussion Group,6,22
19166198,Edinburgh University Alumni Club (San Francisco Bay Area),6,12
19192799,New York Armchair Intelligence Analysis Meetup,6,11
19222695,International School of Self Awareness - New York,6,13
19235937,eastsiders over 60,6,16
19320798,American History Meetup,6,4
19333907,New York Intellectual Discussion Meetup,6,16
19334674,NYACC: New York Amateur Computer Club,6,4
19407665,Gurteen Knowledge Management NYC,6,6
19438627,Research Collaborations Without Border (RCWB),6,23
19459307,"Social Research, Architecture and Design Meetup",6,23
19470034,Chicago Humanities Meetup,6,18
19475178,Ben Franklin Appreciation Society,6,11
